{
  "$schema": "http://json-schema.org/draft-07/schema#",
  "$id": "https://github.com/jpgrusling/claude-plugins/plugins/crew/reference/preferences.schema.json",
  "title": "Crew user-level preferences",
  "description": "Optional per-user preferences at ~/.claude/crew/preferences.json (never committed to a repo). Two kinds of field. LIVE fields (models, personas, visualQA.tool) are resolved by the foreman at runtime on every run — profile pin > these preferences > plugin default — and are NOT written into a repo's .crew/profile.json. SEED fields (planDir, conventions, permissions) pre-fill the /crew:init interview and are copied into the committed profile as project facts. Every field is optional; a partial file is valid.",
  "type": "object",
  "additionalProperties": false,
  "properties": {
    "version": {
      "type": "integer",
      "description": "Preferences schema version.",
      "const": 1
    },
    "models": {
      "type": "object",
      "description": "LIVE. Your standing per-role model tier, resolved at dispatch (profile pin > these > plugin default). Never persisted into a repo profile unless a project pins it. 'inherit' uses the session model. Only scout defaults to a cheaper tier; surveyor and inspector are judgment roles and stay strong.",
      "additionalProperties": false,
      "properties": {
        "surveyor": { "type": "string", "default": "inherit" },
        "builder": { "type": "string", "default": "inherit" },
        "inspector": { "type": "string", "default": "inherit" },
        "diagnostician": { "type": "string", "default": "inherit" },
        "scout": { "type": "string", "default": "claude-sonnet-5" },
        "reviewer": { "type": "string", "default": "inherit" },
        "tester": { "type": "string", "default": "inherit" },
        "architect": { "type": "string", "default": "inherit" },
        "auditor": { "type": "string", "default": "inherit" }
      }
    },
    "personas": {
      "type": "object",
      "description": "LIVE. Your preferred persona skin, applied by the foreman at dispatch for narration only. Resolved profile pin > these > plugin default; never persisted into a repo profile unless a project pins a skin. Copy a shipped preset's map (see presets.json) or set custom names.",
      "additionalProperties": false,
      "properties": {
        "foreman": { "type": "string" },
        "surveyor": { "type": "string" },
        "builder": { "type": "string" },
        "inspector": { "type": "string" },
        "diagnostician": { "type": "string" },
        "scout": { "type": "string" },
        "reviewer": { "type": "string" },
        "tester": { "type": "string" },
        "architect": { "type": "string" },
        "auditor": { "type": "string" }
      }
    },
    "visualQA": {
      "type": "object",
      "description": "LIVE. Your standing visual-QA driver. Only `tool` is a preference (resolved profile pin > this > default `playwright`); `target`/`startCommand` are project facts, always set per-project at init. Set `none` if you don't run Playwright.",
      "additionalProperties": false,
      "properties": {
        "tool": { "type": "string", "enum": ["playwright", "none"] }
      }
    },
    "planDir": {
      "type": "string",
      "description": "SEED. Preferred plan dir for new projects; copied into the committed profile at init.",
      "default": ".crew/plans"
    },
    "conventions": {
      "type": "object",
      "description": "SEED. Default conventions doc to look for, and/or standing notes to seed a new project's profile at init.",
      "additionalProperties": false,
      "properties": {
        "docRef": {
          "type": "string",
          "description": "In-repo conventions doc init should look for first (e.g. AGENTS.md, CLAUDE.md)."
        },
        "notes": { "type": "string" }
      }
    },
    "permissions": {
      "type": "object",
      "description": "SEED. Extra permission entries init should append to a project's .claude/settings.json, on top of the plugin baseline.",
      "additionalProperties": false,
      "properties": {
        "allow": { "type": "array", "items": { "type": "string" } }
      }
    }
  }
}
