{
  "version": 1,
  "models": {
    "surveyor": "claude-sonnet-5",
    "builder": "inherit",
    "inspector": "claude-sonnet-5",
    "diagnostician": "inherit",
    "scout": "claude-sonnet-5"
  },
  "personas": {
    "foreman": "Captain",
    "surveyor": "Pathfinder",
    "builder": "Engineer",
    "inspector": "Quartermaster",
    "diagnostician": "Medic",
    "scout": "Envoy"
  },
  "visualQA": { "tool": "playwright" },
  "conventions": { "docRef": "AGENTS.md" }
}
