{
  "version": 1,
  "models": {
    "surveyor": "inherit",
    "builder": "inherit",
    "inspector": "inherit",
    "diagnostician": "inherit",
    "scout": "claude-sonnet-5",
    "reviewer": "inherit",
    "tester": "inherit",
    "architect": "inherit",
    "auditor": "inherit"
  },
  "personas": {
    "foreman": "Captain",
    "surveyor": "Pathfinder",
    "builder": "Engineer",
    "inspector": "Quartermaster",
    "diagnostician": "Medic",
    "scout": "Envoy",
    "reviewer": "Navigator",
    "tester": "Ranger",
    "architect": "Cartographer",
    "auditor": "Sentry"
  },
  "visualQA": { "tool": "playwright" },
  "conventions": { "docRef": "AGENTS.md" }
}
